{
  "applies_to": {
    "claude_code": {
      "max_exclusive": "2.1.305",
      "min_inclusive": "2.1.304"
    },
    "notes": "First-party 304 release delta and native subset; not approved for model use.",
    "surfaces": [
      "cli"
    ]
  },
  "areas": {
    "primary": [
      "E"
    ],
    "secondary": [
      "Q",
      "U"
    ]
  },
  "authority": "guidance",
  "claim_id": "K-0072",
  "decision_record": null,
  "evidence": [
    {
      "commit_sha": null,
      "kind": "official-doc",
      "locator": "https://code.claude.com/docs/en/plugins/mods/events#the-order-mods-run-in",
      "notes": "Unapproved HTML observation only, NOT an independently reviewed supporting source section. Additional official release: https://github.com/anthropics/claude-code/releases/tag/v2.1.304; native subset: docs/reports/2026-10-20-cli304-p1-toolcheck-six-native-safety.json",
      "role": "context",
      "snapshot_sha256": "ca95c067e1feddc7391e5ccd337813e8554677c2d6034510a38c75501bec5662",
      "source_id": "M004"
    }
  ],
  "kind": "behavior",
  "lifecycle": "candidate",
  "related_claims": [
    "K-0042",
    "K-0063"
  ],
  "statement": "CLI 2.1.304 release notes report a new user-facing transcript line when an earlier plugin skips a later Mod hook, naming the event and the plugin. The current official Events section documents hook ordering, but target-matched two-plugin skip propagation, transcript readback and host surface consistency have not yet been verified. Keep this as an unapproved behavior candidate.",
  "subject": "mods.prior-plugin-hook-skip-transcript-cli304-pending",
  "supersedes": [],
  "verification": {
    "runtime": "not-run",
    "runtime_profiles": [],
    "source": "indexed",
    "test_evidence": []
  }
}
