{
  "applies_to": {
    "claude_code": {
      "max_exclusive": "2.1.297",
      "min_inclusive": "2.1.296"
    },
    "notes": "官方文档审阅的 CLI 2.1.296 工程建议；并非已执行真实宿主的集成测试。",
    "surfaces": [
      "cli"
    ]
  },
  "areas": {
    "primary": [
      "P"
    ],
    "secondary": [
      "E"
    ]
  },
  "authority": "guidance",
  "claim_id": "K-0023",
  "decision_record": "decisions/K-0023.json",
  "evidence": [
    {
      "commit_sha": null,
      "kind": "official-doc",
      "locator": "https://code.claude.com/docs/en/plugins/mods/overview#what-a-mod-can-reach",
      "notes": "同时存有相应官方 Markdown 章节指纹；HTTP HTML 内容指纹单独保存在 Source Registry。",
      "role": "supports",
      "snapshot_sha256": "a288c4aac143ee6bd3e0b5d9a6cef04f77be2dd38b6aa0d2b7cb25aab108419d",
      "source_id": "M001"
    }
  ],
  "kind": "best-practice",
  "lifecycle": "approved",
  "related_claims": [],
  "statement": "评审 Mods 时必须把它视为在用户权限下运行的代码，不能依赖 Bash Sandbox 保护本机文件、环境变量或网络访问。",
  "subject": "mods.security.mods-are-not-sandboxed",
  "supersedes": [],
  "verification": {
    "runtime": "not-run",
    "runtime_profiles": [],
    "source": "reviewed",
    "test_evidence": []
  }
}
