{
  "applies_to": {
    "claude_code": {
      "max_exclusive": "2.1.303",
      "min_inclusive": "2.1.302"
    },
    "notes": "Claude Code CLI 2.1.302 专用重新审查 Claim；旧版审批保持不变，不能推断下一个发行版适用。",
    "surfaces": [
      "cli"
    ]
  },
  "areas": {
    "primary": [
      "E"
    ],
    "secondary": [
      "Q",
      "P"
    ]
  },
  "authority": "guidance",
  "claim_id": "K-0068",
  "decision_record": "decisions/K-0068.json",
  "evidence": [
    {
      "commit_sha": null,
      "kind": "official-doc",
      "locator": "https://code.claude.com/docs/en/plugins/mods/events#observe-an-event",
      "notes": "Anthropic 官方 CLI 2.1.302 单独章节复核，版本限定；原始旧版审阅证据不变。",
      "role": "supports",
      "snapshot_sha256": "3feeaa1ff4a91c21a1825fef97fb76dd7fc40f79a8c669c887a7a35b536e05f6",
      "source_id": "M004"
    }
  ],
  "kind": "best-practice",
  "lifecycle": "approved",
  "related_claims": [],
  "statement": "Claude Code CLI 2.1.302 的透明 `tool.call` 观察器应该将诊断操作与下游工具结果完全隔离：最小安全形式是直接 `return next(e)`。如果必须记录日志，`next(e)` 只能调用一次，且诊断失败不应替换原始返回值或异常。为捕获同步抛错及异步诊断 Promise 拒绝，独立的日志保护块应在 `try { return await next(e); } finally { try { await Promise.resolve(console.log(\"observer done\")); } catch { /* 仅忽略诊断失败 */ } }` 中等待日志完成。不可在 `finally` 中直接调用未保护的日志（即使已 `await next(e)`），也不可在 `catch(error)` 中调用可能覆盖原始异常的日志。如果诊断 API 返回 Promise，仅有未带 `await` 的普通 `try/catch` 不足以捕获后续 rejection。以上 console.log 只表示 JavaScript 日志写法，不保证任何 Mods 专用日志 API 存在；目标CLI之外的兼容性及真实用户代码的运行结果仍需单独核验。",
  "subject": "mods.events.fail-isolated-transparent-observer-diagnostics-async-safe",
  "supersedes": [
    "K-0037"
  ],
  "verification": {
    "runtime": "not-run",
    "runtime_profiles": [],
    "source": "reviewed",
    "test_evidence": []
  }
}
