{
  "applies_to": {
    "claude_code": {
      "max_exclusive": "2.1.305",
      "min_inclusive": "2.1.304"
    },
    "notes": "First-party 304 release delta and native subset; not approved for model use.",
    "surfaces": [
      "cli"
    ]
  },
  "areas": {
    "primary": [
      "P"
    ],
    "secondary": [
      "E",
      "Q"
    ]
  },
  "authority": "guidance",
  "claim_id": "K-0074",
  "decision_record": null,
  "evidence": [
    {
      "commit_sha": null,
      "kind": "official-doc",
      "locator": "https://code.claude.com/docs/en/plugins/mods/events#handle-a-hook-that-fails",
      "notes": "Unapproved HTML observation only, NOT an independently reviewed supporting source section. Additional official release: https://github.com/anthropics/claude-code/releases/tag/v2.1.304; native subset: docs/reports/2026-10-20-cli304-p1-toolcheck-six-native-safety.json",
      "role": "context",
      "snapshot_sha256": "ca95c067e1feddc7391e5ccd337813e8554677c2d6034510a38c75501bec5662",
      "source_id": "M004"
    }
  ],
  "kind": "best-practice",
  "lifecycle": "candidate",
  "related_claims": [
    "K-0043",
    "K-0058",
    "K-0068"
  ],
  "statement": "The current official Events documentation describes registration catch behavior and recommends a deny outcome for a failed tool.check gate. In six synthetic native 304 tests a guarded permission hook preserved allow/ask/deny and denied a forced exception; negative controls caught an unguarded gate and a denial-to-allow override. Real host managed-rule precedence, human approval and genuine user tools remain untested, so this source-scoped diagnostic is NOT a fully approved 304 Claim.",
  "subject": "mods.tool-check-registration-catch-deny-cli304-pending",
  "supersedes": [],
  "verification": {
    "runtime": "not-run",
    "runtime_profiles": [],
    "source": "indexed",
    "test_evidence": []
  }
}
