{
  "applies_to": {
    "claude_code": {
      "max_exclusive": "2.1.303",
      "min_inclusive": "2.1.302"
    },
    "notes": "Claude Code CLI 2.1.302 专用重新审查 Claim；旧版审批保持不变，不能推断下一个发行版适用。",
    "surfaces": [
      "cli"
    ]
  },
  "areas": {
    "primary": [
      "Q"
    ],
    "secondary": [
      "U"
    ]
  },
  "authority": "guidance",
  "claim_id": "K-0055",
  "decision_record": "decisions/K-0055.json",
  "evidence": [
    {
      "commit_sha": null,
      "kind": "official-doc",
      "locator": "https://code.claude.com/docs/en/plugins/mods/test#test-a-drawing",
      "notes": "Anthropic 官方 CLI 2.1.302 单独章节复核，版本限定；原始旧版审阅证据不变。",
      "role": "supports",
      "snapshot_sha256": "66dc16eecaba81947455e4087c7ed268fc4c4bbb4101b6afa9ed6af1d944da93",
      "source_id": "M008"
    }
  ],
  "kind": "best-practice",
  "lifecycle": "approved",
  "related_claims": [],
  "statement": "UI 测试应使用测试渲染接口检查控件树，并通过控件 key 驱动按钮和输入行为；另行验证真实 CLI/桌面显示。",
  "subject": "mods.testing.ui-render-interaction",
  "supersedes": [
    "K-0022"
  ],
  "verification": {
    "runtime": "not-run",
    "runtime_profiles": [],
    "source": "reviewed",
    "test_evidence": []
  }
}
