{
  "applies_to": {
    "claude_code": {
      "max_exclusive": "2.1.303",
      "min_inclusive": "2.1.302"
    },
    "notes": "Claude Code CLI 2.1.302 专用重新审查 Claim；旧版审批保持不变，不能推断下一个发行版适用。",
    "surfaces": [
      "cli"
    ]
  },
  "areas": {
    "primary": [
      "U"
    ],
    "secondary": [
      "E"
    ]
  },
  "authority": "guidance",
  "claim_id": "K-0060",
  "decision_record": "decisions/K-0060.json",
  "evidence": [
    {
      "commit_sha": null,
      "kind": "official-doc",
      "locator": "https://code.claude.com/docs/en/plugins/mods/interface#pick-where-to-draw",
      "notes": "Anthropic 官方 CLI 2.1.302 单独章节复核，版本限定；原始旧版审阅证据不变。",
      "role": "supports",
      "snapshot_sha256": "745c35f2c4824f04e1b29508e786f5764d688a69dacef92ac60adcbae53f15e7",
      "source_id": "M006"
    }
  ],
  "kind": "best-practice",
  "lifecycle": "approved",
  "related_claims": [],
  "statement": "绘制自定义界面时先选择 Pane 或 AbovePrompt 等渲染位置，并以 ui.render 匹配器和 requestId 限定所属 Mod 的绘制范围。",
  "subject": "mods.ui.render-site-selection",
  "supersedes": [
    "K-0027"
  ],
  "verification": {
    "runtime": "not-run",
    "runtime_profiles": [],
    "source": "reviewed",
    "test_evidence": []
  }
}
