{
  "applies_to": {
    "claude_code": {
      "max_exclusive": "2.1.297",
      "min_inclusive": "2.1.296"
    },
    "notes": "官方文档审阅的 CLI 2.1.296 工程建议；并非已执行真实宿主的集成测试。",
    "surfaces": [
      "cli"
    ]
  },
  "areas": {
    "primary": [
      "T"
    ],
    "secondary": [
      "Q"
    ]
  },
  "authority": "guidance",
  "claim_id": "K-0017",
  "decision_record": "decisions/K-0017.json",
  "evidence": [
    {
      "commit_sha": null,
      "kind": "official-doc",
      "locator": "https://code.claude.com/docs/en/plugins/mods/create#check-what-claude-code-reads-from-your-mod",
      "notes": "同时存有相应官方 Markdown 章节指纹；HTTP HTML 内容指纹单独保存在 Source Registry。",
      "role": "supports",
      "snapshot_sha256": "228441bad944aa169a8708981c44a3565243f77ef2105e72da339829ad4f4fe3",
      "source_id": "M002"
    }
  ],
  "kind": "best-practice",
  "lifecycle": "approved",
  "related_claims": [],
  "statement": "为使静态扫描可靠，应使用字符串字面量声明事件名，并避免动态 import、非相对插件内模块导入或遮蔽 register 的 on 参数。",
  "subject": "mods.types.literal-hook-names",
  "supersedes": [],
  "verification": {
    "runtime": "not-run",
    "runtime_profiles": [],
    "source": "reviewed",
    "test_evidence": []
  }
}
