{
  "applies_to": {
    "claude_code": {
      "max_exclusive": "2.1.303",
      "min_inclusive": "2.1.302"
    },
    "notes": "Claude Code CLI 2.1.302 专用重新审查 Claim；旧版审批保持不变，不能推断下一个发行版适用。",
    "surfaces": [
      "cli"
    ]
  },
  "areas": {
    "primary": [
      "T"
    ],
    "secondary": [
      "E"
    ]
  },
  "authority": "guidance",
  "claim_id": "K-0051",
  "decision_record": "decisions/K-0051.json",
  "evidence": [
    {
      "commit_sha": null,
      "kind": "official-doc",
      "locator": "https://code.claude.com/docs/en/plugins/mods/reference#files",
      "notes": "Anthropic 官方 CLI 2.1.302 单独章节复核，版本限定；原始旧版审阅证据不变。",
      "role": "supports",
      "snapshot_sha256": "fa3709335c21f11661e9b59479038d3afd09c95523bbcef0d965e6102c8e53d4",
      "source_id": "M003"
    }
  ],
  "kind": "best-practice",
  "lifecycle": "approved",
  "related_claims": [],
  "statement": "建立 Mod 项目时应分别维护插件 Manifest、hooks/hooks.json 中的 modules 声明以及导出 register 的 hooks 模块。",
  "subject": "mods.types.mod-file-layout",
  "supersedes": [
    "K-0018"
  ],
  "verification": {
    "runtime": "not-run",
    "runtime_profiles": [],
    "source": "reviewed",
    "test_evidence": []
  }
}
