{
  "applies_to": {
    "claude_code": {
      "max_exclusive": "2.1.303",
      "min_inclusive": "2.1.302"
    },
    "notes": "Claude Code CLI 2.1.302 专用重新审查 Claim；旧版审批保持不变，不能推断下一个发行版适用。",
    "surfaces": [
      "cli"
    ]
  },
  "areas": {
    "primary": [
      "E"
    ],
    "secondary": [
      "P"
    ]
  },
  "authority": "guidance",
  "claim_id": "K-0042",
  "decision_record": "decisions/K-0042.json",
  "evidence": [
    {
      "commit_sha": null,
      "kind": "official-doc",
      "locator": "https://code.claude.com/docs/en/plugins/mods/events#the-order-mods-run-in",
      "notes": "Anthropic 官方 CLI 2.1.302 单独章节复核，版本限定；原始旧版审阅证据不变。",
      "role": "supports",
      "snapshot_sha256": "3feeaa1ff4a91c21a1825fef97fb76dd7fc40f79a8c669c887a7a35b536e05f6",
      "source_id": "M004"
    }
  ],
  "kind": "best-practice",
  "lifecycle": "approved",
  "related_claims": [],
  "statement": "多个 Mod 的同名事件处理器属于一个中间件调用链；设计工具保护逻辑时应先核对执行顺序与失败处理。",
  "subject": "mods.events.hook-order-review",
  "supersedes": [
    "K-0009"
  ],
  "verification": {
    "runtime": "not-run",
    "runtime_profiles": [],
    "source": "reviewed",
    "test_evidence": []
  }
}
